link,tags,likes,comments,path
https://cdn.pixabay.com/photo/2022/04/08/13/45/flowers-7119514__340.jpg,eat season Cherry friends. drink This in with now We under is sit of our Japan. ever blossoms “hanami”? heard and for Have trees the cherry you,14,8,images/flowers-7119514__340.jpg
https://cdn.pixabay.com/photo/2022/03/19/08/45/alley-7078098__340.jpg,... In Städtchen einem kleinen,57,33,images/alley-7078098__340.jpg
https://cdn.pixabay.com/photo/2022/04/06/06/30/drake-7114868__340.jpg,"Drake, Waterbird, Wings",20,19,images/drake-7114868__340.jpg
https://cdn.pixabay.com/photo/2021/11/17/10/57/pine-cone-6803226__340.jpg,"Cone, Green, Branch Pine Fir",126,43,images/pine-cone-6803226__340.jpg
https://cdn.pixabay.com/photo/2021/10/15/22/59/heron-6713611__340.jpg,"River, Lake, Egret, Pond Great Heron,",163,127,images/heron-6713611__340.jpg
https://cdn.pixabay.com/photo/2021/10/08/06/45/seagulls-6690361__340.jpg,"Seagulls, Sea, Birds, Nature, Sky Ocean,",121,30,images/seagulls-6690361__340.jpg
https://cdn.pixabay.com/photo/2021/07/22/21/55/mountains-6486093__480.jpg,"Tourism, Hike, Alpine Mountains, Nature,",122,24,images/mountains-6486093__480.jpg
https://cdn.pixabay.com/photo/2022/04/04/08/43/road-7110643__340.jpg,"Road, Countryside, Mountain, Landscape",29,0,images/road-7110643__340.jpg
https://cdn.pixabay.com/photo/2021/11/11/16/29/tree-6786654__340.jpg,"Autumn, Leaves, Tree, Season, Nature",89,21,images/tree-6786654__340.jpg
https://cdn.pixabay.com/photo/2022/03/23/17/41/fantasy-7087606__340.jpg,"Light, Fantasy, Magic Elf, Bird Plants,",32,17,images/fantasy-7087606__340.jpg
https://cdn.pixabay.com/photo/2022/03/12/09/27/couple-7063784__340.jpg,"Couple, Walking, Sunset Meadow, Nature,",17,5,images/couple-7063784__340.jpg
https://cdn.pixabay.com/photo/2016/12/16/15/25/christmas-1911637__340.jpg,"Background, Lay Christmas, Flat",2860,460,images/christmas-1911637__340.jpg
https://cdn.pixabay.com/photo/2022/04/06/17/40/blackthorn-7116000__340.jpg,"Blackthorn, Spinosa Winter, Sloe, Prunus",23,20,images/blackthorn-7116000__340.jpg
https://cdn.pixabay.com/photo/2021/08/27/19/55/boat-6579441__340.jpg,"River, Woods Boat, Forest, Landscape,",145,26,images/boat-6579441__340.jpg
https://cdn.pixabay.com/photo/2022/04/09/18/25/walnuts-7122043__340.jpg,"Walnuts, Nutrition Healthy, Nuts, Food,",11,5,images/walnuts-7122043__340.jpg
https://cdn.pixabay.com/photo/2022/04/12/04/46/climate-change-7127153__340.jpg,"Change, Protest, People Climate",12,9,images/climate-change-7127153__340.jpg
https://cdn.pixabay.com/photo/2021/08/08/15/45/mountains-6531264__340.jpg,"Mountains, Fortress Sunset, Germany,",116,26,images/mountains-6531264__340.jpg
https://cdn.pixabay.com/photo/2021/11/27/18/28/candles-6828695__340.jpg,"Candles, Candlelight, Christmas",122,60,images/candles-6828695__340.jpg
https://cdn.pixabay.com/photo/2022/02/19/08/48/flower-7022112__340.jpg,"Flower, Spring Butterfly, Fantasy,",97,72,images/flower-7022112__340.jpg
https://cdn.pixabay.com/photo/2022/04/04/10/39/australian-wood-duck-7110865__340.jpg,"Australian Bird Wood Duck,",45,44,images/australian-wood-duck-7110865__340.jpg
https://cdn.pixabay.com/photo/2021/10/04/16/42/dog-6680642__340.jpg,"Pet, Dog, Cute, Puppy, Doggy, Animal",89,16,images/dog-6680642__340.jpg
https://cdn.pixabay.com/photo/2022/03/31/05/07/cherry-blossom-7102224__340.jpg,"Cherry Spring, Blossom, Nature, Flowers",57,48,images/cherry-blossom-7102224__340.jpg
https://cdn.pixabay.com/photo/2021/12/26/19/36/christmas-tree-6895765__480.jpg,"Holiday, Tree, Christmas Season",54,11,images/christmas-tree-6895765__480.jpg
https://cdn.pixabay.com/photo/2021/07/26/22/04/sea-shell-6495338__340.jpg,"Sea Giant Shell, Conch",206,95,images/sea-shell-6495338__340.jpg
https://cdn.pixabay.com/photo/2021/02/05/18/05/paper-5985445__340.jpg,"Texture, Crumpled, Shadows, Fold Paper,",186,38,images/paper-5985445__340.jpg
https://cdn.pixabay.com/photo/2022/03/31/14/16/bee-7103114__340.jpg,"Pollination, Macro Entomology, Bee,",57,41,images/bee-7103114__340.jpg
https://cdn.pixabay.com/photo/2022/04/06/05/26/butterfly-7114816__340.jpg,"Aurora Butterfly, Meadow",25,16,images/butterfly-7114816__340.jpg
https://cdn.pixabay.com/photo/2021/12/02/13/02/candles-6840499__340.jpg,4 Weihnachtskerzen,70,24,images/candles-6840499__340.jpg
https://cdn.pixabay.com/photo/2022/04/06/14/27/mute-swan-7115661__340.jpg,a description Add (optional),40,33,images/mute-swan-7115661__340.jpg
https://cdn.pixabay.com/photo/2022/04/09/06/20/tulip-7120843__340.jpg,"Flower Tulip, Spring, Flowering,",9,2,images/tulip-7120843__340.jpg
https://cdn.pixabay.com/photo/2022/03/22/19/29/town-7085835__340.jpg,"Nature, Countryside, Landscape Town,",69,62,images/town-7085835__340.jpg
https://cdn.pixabay.com/photo/2022/04/11/07/30/birds-7124996__340.jpg,"Argentina. ave una hornero y Sudamérica paseriforme meridional rufus especie perteneciente ) los familia a junto El ( Furnarius República de nacional el furnáridos, Furnarius. compone, con otras cinco Hornero género especies la endémico es",7,6,images/birds-7124996__340.jpg
https://cdn.pixabay.com/photo/2022/04/05/12/00/cherry-blossom-7113414__340.jpg,"Cherry Spring, Sakura Flowers, Blossom,",32,0,images/cherry-blossom-7113414__340.jpg
https://cdn.pixabay.com/photo/2022/04/07/23/58/fantasy-7118471__340.jpg,"Fantasy, No Truth, Silence, Bound",19,24,images/fantasy-7118471__340.jpg
https://cdn.pixabay.com/photo/2022/03/01/09/15/salad-7040875__340.jpg,"Healthy, Salad, Vitamins Berry, Fruit,",30,10,images/salad-7040875__340.jpg
https://cdn.pixabay.com/photo/2021/11/01/08/39/petit-minou-lighthouse-6759731__340.jpg,"Sea Minou Petit Lighthouse,",61,15,images/petit-minou-lighthouse-6759731__340.jpg
https://cdn.pixabay.com/photo/2022/04/11/19/05/easter-bunny-7126452__340.jpg,"Easter, Easter Bunny, Decorations",12,8,images/easter-bunny-7126452__340.jpg
https://cdn.pixabay.com/photo/2022/04/09/22/33/bird-7122361__340.jpg,"Fauna Bird, Species, Ornithology, Heron,",12,7,images/bird-7122361__340.jpg
https://cdn.pixabay.com/photo/2022/04/01/08/57/shepherds-purses-7104384__480.jpg,"Capsella, Grass Shepherd'S-Purses,",45,40,images/shepherds-purses-7104384__480.jpg
https://cdn.pixabay.com/photo/2022/04/07/11/55/bernkastel-kues-7117366__340.jpg,"Germany, Cityscape Bernkastel-Kues,",20,10,images/bernkastel-kues-7117366__340.jpg
https://cdn.pixabay.com/photo/2021/04/21/13/20/cherry-blossoms-6196363__340.jpg,"Sakura, Cherry Flowers Blossoms,",406,211,images/cherry-blossoms-6196363__340.jpg
https://cdn.pixabay.com/photo/2022/04/11/20/31/purple-flowers-7126569__340.jpg,"Pasqueflowers Purple Flowers,",5,2,images/purple-flowers-7126569__340.jpg
https://cdn.pixabay.com/photo/2021/03/02/01/07/cyberpunk-6061251__340.jpg,"Platform Cyberpunk, City, Street,",220,32,images/cyberpunk-6061251__340.jpg
https://cdn.pixabay.com/photo/2022/03/29/12/31/leaves-7099402__340.jpg,"Leaves, Botany, Plant Nature, Growth,",61,16,images/leaves-7099402__340.jpg
https://cdn.pixabay.com/photo/2022/04/10/10/34/flower-7123108__340.jpg,"Flower, Petals, Baby Rose",8,4,images/flower-7123108__340.jpg
https://cdn.pixabay.com/photo/2022/03/05/09/23/birds-7048729__340.jpg,"Fauna Birds, Duck, Species, Ornithology,",103,79,images/birds-7048729__340.jpg
https://cdn.pixabay.com/photo/2022/04/10/18/04/robin-7123932__340.jpg,"Robin, Plumage Feathers, Bird, Beak,",4,2,images/robin-7123932__340.jpg
https://cdn.pixabay.com/photo/2018/06/13/18/20/waves-3473335__340.jpg,"Water Beach, Waves, Sea, Blue Ocean,",1807,310,images/waves-3473335__340.jpg
https://cdn.pixabay.com/photo/2022/03/05/22/13/daffodil-7050408__340.jpg,"Daffodil, Flower, Yellow Petals",87,73,images/daffodil-7050408__340.jpg
https://cdn.pixabay.com/photo/2022/04/09/16/26/bird-7121805__340.jpg,"Ornithology Warbler, Bird, Yellow",3,2,images/bird-7121805__340.jpg
https://cdn.pixabay.com/photo/2022/04/11/20/01/leopard-7126525__340.jpg,"Leopard, Big Mammal, Animal, Cat",7,0,images/leopard-7126525__340.jpg
https://cdn.pixabay.com/photo/2022/01/28/21/10/honeybee-6975865__340.jpg,"Pollination, Bee Honeybee, Sunflower,",51,11,images/honeybee-6975865__340.jpg
https://cdn.pixabay.com/photo/2020/02/08/14/36/trees-4830285__340.jpg,"Trees, Snow, Cold, Nature Winter, White,",442,106,images/trees-4830285__340.jpg
https://cdn.pixabay.com/photo/2021/10/29/14/27/nature-6752035__480.jpg,alps. dangerous Blanc the High in as 👀 are of Chamonix French blanche. walk Mont The mountains they beautiful steep ridge valley Climbers,85,16,images/nature-6752035__480.jpg
https://cdn.pixabay.com/photo/2021/08/15/14/47/couple-6548045__340.jpg,"Love, Silhouette, Couple, Relationship",76,20,images/couple-6548045__340.jpg
https://cdn.pixabay.com/photo/2021/11/25/09/28/amsterdam-6823002__340.jpg,"Amsterdam, Dam Square, Child, Pigeons",91,19,images/amsterdam-6823002__340.jpg
https://cdn.pixabay.com/photo/2022/04/09/12/11/duck-7121326__340.jpg,"Plumage Feathers, Bird, Beak, Duck,",7,2,images/duck-7121326__340.jpg
https://cdn.pixabay.com/photo/2022/04/09/21/11/rice-7122289__340.jpg,"Tomatoes, Rice, Table Food, Grain, Dish,",7,2,images/rice-7122289__340.jpg
https://cdn.pixabay.com/photo/2021/08/08/15/01/trading-6531134__340.jpg,"Blockchain, Cryptocurrency Trading,",38,7,images/trading-6531134__340.jpg
https://cdn.pixabay.com/photo/2021/08/14/20/44/stones-6546233__340.jpg,"Rocks Balance, Balanced Stones, Rock,",109,19,images/stones-6546233__340.jpg
https://cdn.pixabay.com/photo/2021/03/11/02/57/mountain-6086083__340.jpg,"Sunrise, Snow, Mountain, Summit Peak,",286,71,images/mountain-6086083__340.jpg
https://cdn.pixabay.com/photo/2021/08/31/18/51/forest-6589852__340.jpg,"Forest, Trees, Outdoors Woods, Nature,",102,13,images/forest-6589852__340.jpg
https://cdn.pixabay.com/photo/2022/04/03/14/25/bird-7109091__340.jpg,"Robin, Fauna Bird, Species, Ornithology,",36,27,images/bird-7109091__340.jpg
https://cdn.pixabay.com/photo/2022/04/08/15/01/mushrooms-7119658__340.jpg,"Mushrooms, Floor Fungi, Mycology, Forest",10,5,images/mushrooms-7119658__340.jpg
https://cdn.pixabay.com/photo/2022/04/07/10/19/crafting-7117240__340.jpg,"Aesthetic Daisies, Vintage Crafting,",9,3,images/crafting-7117240__340.jpg
https://cdn.pixabay.com/photo/2020/07/27/14/34/forest-5442598__340.jpg,"Night Stars, Mountains, Forest, Sky",411,50,images/forest-5442598__340.jpg
https://cdn.pixabay.com/photo/2022/01/03/21/08/street-6913633__340.jpg,Alps Street Sunset in Bavarian,35,6,images/street-6913633__340.jpg
https://cdn.pixabay.com/photo/2022/04/11/15/32/petals-7126056__480.jpg,"Blossom Tree, Garden, Petals, Cherry,",7,5,images/petals-7126056__480.jpg
https://cdn.pixabay.com/photo/2016/11/29/13/37/christmas-1869902__340.jpg,"Presents Tree, Christmas, Christmas",1184,292,images/christmas-1869902__340.jpg
https://cdn.pixabay.com/photo/2022/03/27/10/19/squill-7094638__340.jpg,"Flowers, Scilla Squill, Plant,",66,51,images/squill-7094638__340.jpg
https://cdn.pixabay.com/photo/2022/04/05/15/13/soap-bubbles-7113833__340.jpg,"Colour, Bubbles, Macro, Pattern Soap",21,16,images/soap-bubbles-7113833__340.jpg
https://cdn.pixabay.com/photo/2021/07/21/12/22/lavenders-6482952__340.jpg,"Field Flowers, Lavender Lavenders,",158,36,images/lavenders-6482952__340.jpg
https://cdn.pixabay.com/photo/2022/04/03/12/45/flowers-7108857__340.jpg,"Lucile'S The Snow Flowers, Of Glory",39,25,images/flowers-7108857__340.jpg
https://cdn.pixabay.com/photo/2021/11/17/17/03/roses-6804169__340.jpg,"Flowers, Roses, Yellow Flowers",96,25,images/roses-6804169__340.jpg
https://cdn.pixabay.com/photo/2022/02/07/15/22/fuel-6999638__340.jpg,"Station, Fuel, Gas Refueling,",9,3,images/fuel-6999638__340.jpg
https://cdn.pixabay.com/photo/2022/04/09/16/46/peace-7121863__340.jpg,"Sign, Ukraine Peace War, Peace, Against",13,8,images/peace-7121863__340.jpg
https://cdn.pixabay.com/photo/2022/03/20/10/50/lake-7080525__340.jpg,"Travel Lake, Dusk, To Mountains, Nature,",72,62,images/lake-7080525__340.jpg
