link,tags,likes,comments,path
https://cdn.pixabay.com/photo/2022/03/06/05/30/clouds-7050884__480.jpg,"Atmosphere, Clouds, Sky, Blue Sky",196,55,images/clouds-7050884__480.jpg
https://cdn.pixabay.com/photo/2022/04/07/11/45/bird-7117346__340.jpg,"Bird, Ornithology, Hummingbird",76,20,images/bird-7117346__340.jpg
https://cdn.pixabay.com/photo/2022/02/28/15/28/sea-7039471__340.jpg,"Subtropical Sea, Rainbow, Rainfall,",282,106,images/sea-7039471__340.jpg
https://cdn.pixabay.com/photo/2022/04/04/02/52/cherry-blossoms-7110279__340.jpg,"Cherry Japan, Sakura Blossoms, Road,",42,11,images/cherry-blossoms-7110279__340.jpg
https://cdn.pixabay.com/photo/2022/04/09/18/06/cape-marguerite-7121992__340.jpg,"Marguerite, Plant Flower, Cape",39,15,images/cape-marguerite-7121992__340.jpg
https://cdn.pixabay.com/photo/2021/11/13/23/06/tree-6792528__340.jpg,The Rest Relaxing Tree Under,522,108,images/tree-6792528__340.jpg
https://cdn.pixabay.com/photo/2022/04/07/02/56/cottontail-rabbit-7116707__340.jpg,"Cottontail Wild Rabbit, Grass",51,10,images/cottontail-rabbit-7116707__340.jpg
https://cdn.pixabay.com/photo/2022/03/19/21/11/crocus-7079550__340.jpg,"Plant Flowers, Spring, Crocus,",135,44,images/crocus-7079550__340.jpg
https://cdn.pixabay.com/photo/2022/04/09/17/30/coffee-7121939__340.jpg,"Vacation, Table Café, Drink, Coffee,",26,5,images/coffee-7121939__340.jpg
https://cdn.pixabay.com/photo/2022/03/25/19/24/waterfall-7091641__340.jpg,"Light Waterfall, Epic, Fall, Nature,",96,21,images/waterfall-7091641__340.jpg
https://cdn.pixabay.com/photo/2021/08/25/20/42/field-6574455__340.jpg,"Sunrise, Field, Dawn, Morning, Nature",807,131,images/field-6574455__340.jpg
https://cdn.pixabay.com/photo/2022/04/04/18/03/bird-7111988__340.jpg,"Birdwatching, Bird, Robin, Animal",69,19,images/bird-7111988__340.jpg
https://cdn.pixabay.com/photo/2022/04/04/07/58/seedlings-7110591__340.jpg,"Spring Flowers, Bloom Soil, Seedlings,",42,9,images/seedlings-7110591__340.jpg
https://cdn.pixabay.com/photo/2022/03/23/21/27/road-7087957__340.jpg,"Road, Countryside, Hills Highway,",53,14,images/road-7087957__340.jpg
https://cdn.pixabay.com/photo/2022/03/27/15/03/cityscape-7095358__340.jpg,"Bridge, Cityscape, Monochrome, City",45,13,images/cityscape-7095358__340.jpg
https://cdn.pixabay.com/photo/2022/03/25/17/54/sakura-7091532__340.jpg,"Water Sakura, Cherry Spring, Blossoms,",70,12,images/sakura-7091532__340.jpg
https://cdn.pixabay.com/photo/2022/04/01/19/03/background-7105471__480.jpg,"Template, Background, Easter, Art Eggs,",5,2,images/background-7105471__480.jpg
https://cdn.pixabay.com/photo/2022/01/31/12/46/bird-6983434__340.jpg,"Chat, Species Indian Bird, Ornithology,",171,53,images/bird-6983434__340.jpg
https://cdn.pixabay.com/photo/2022/01/18/16/49/town-6947538__340.jpg,"Season Night, Village, Winter, Town,",109,15,images/town-6947538__340.jpg
https://cdn.pixabay.com/photo/2022/04/09/17/42/flower-7121955__340.jpg,"Pansy, Flower, Viola, Blossom, Bloom",55,36,images/flower-7121955__340.jpg
https://cdn.pixabay.com/photo/2021/08/30/21/29/port-6587129__340.jpg,"Port, Vacations Architecture, Lake,",276,49,images/port-6587129__340.jpg
https://cdn.pixabay.com/photo/2022/03/16/02/03/sunflowers-7071449__340.jpg,"Plant Sunflowers, Flowers,",54,21,images/sunflowers-7071449__340.jpg
https://cdn.pixabay.com/photo/2022/03/28/18/41/coffee-7098126__340.jpg,"Coffee, Spring, Morning Flowers,",40,10,images/coffee-7098126__340.jpg
https://cdn.pixabay.com/photo/2022/02/12/06/21/roys-peak-7008528__340.jpg,"Lake, Mountains Roys Peak, Wanaka,",69,19,images/roys-peak-7008528__340.jpg
https://cdn.pixabay.com/photo/2021/11/21/21/14/mountain-6815304__340.jpg,"for likes. many downloads and Thank you, everyone. you",197,0,images/mountain-6815304__340.jpg
https://cdn.pixabay.com/photo/2021/08/22/15/48/nature-6565499__340.jpg,"Nature, Exploration Outdoors, Beach,",272,150,images/nature-6565499__340.jpg
https://cdn.pixabay.com/photo/2022/03/03/11/18/nature-7045125__340.jpg,sunset. Shot The Danish of during Jutland. Coast West,48,11,images/nature-7045125__340.jpg
https://cdn.pixabay.com/photo/2022/03/16/21/01/gentoo-penguin-7073391__340.jpg,"Bird, Gentoo Penguin, Animal",93,22,images/gentoo-penguin-7073391__340.jpg
https://cdn.pixabay.com/photo/2021/11/26/20/45/lantern-6826698__340.jpg,"Lantern, Beach, Water, Sea, Tree Heaven,",243,31,images/lantern-6826698__340.jpg
https://cdn.pixabay.com/photo/2022/04/03/05/03/easter-7108066__340.jpg,"Bunny Easter, Spring, Easter",17,10,images/easter-7108066__340.jpg
https://cdn.pixabay.com/photo/2018/01/14/23/12/nature-3082832__340.jpg,lake brown daytime during trees on rock formation green,3098,495,images/nature-3082832__340.jpg
https://cdn.pixabay.com/photo/2022/02/27/19/46/tourist-attraction-7037967__340.jpg,"Attraction, Travel Eiffel Tourist Tower,",83,21,images/tourist-attraction-7037967__340.jpg
https://cdn.pixabay.com/photo/2022/04/07/22/23/menhir-7118382__480.jpg,"Menhir, Clouds, Stones, Standing Stones",64,49,images/menhir-7118382__480.jpg
https://cdn.pixabay.com/photo/2022/01/13/18/05/road-6935773__340.jpg,"Trees, Snow, Frost, Path Road, Winter,",133,24,images/road-6935773__340.jpg
https://cdn.pixabay.com/photo/2022/04/10/07/03/bird-7122753__340.jpg,"Bird, Woodpecker",28,20,images/bird-7122753__340.jpg
https://cdn.pixabay.com/photo/2021/11/25/19/50/tape-6824489__340.jpg,"Classic Music, Retro, Cassette, Tape,",134,20,images/tape-6824489__340.jpg
https://cdn.pixabay.com/photo/2022/01/10/15/29/wind-mills-6928590__340.jpg,"Wind Clouds, Mills, Power Energy,",144,101,images/wind-mills-6928590__340.jpg
https://cdn.pixabay.com/photo/2022/02/15/07/27/travel-7014427__340.jpg,"Tourism, Tartini, Piran Square, Travel,",70,19,images/travel-7014427__340.jpg
https://cdn.pixabay.com/photo/2022/04/11/04/33/easter-eggs-7124718__340.jpg,"Easter Nest, Eggs Colored Eggs,",29,0,images/easter-eggs-7124718__340.jpg
https://cdn.pixabay.com/photo/2022/02/07/22/27/winter-7000429__340.jpg,"Travel Season, Outdoors, Nature, Winter,",111,24,images/winter-7000429__340.jpg
https://cdn.pixabay.com/photo/2022/04/11/09/40/glacier-7125386__340.jpg,"Glaciers, Glacier, Melting Glacier Dying",36,27,images/glacier-7125386__340.jpg
https://cdn.pixabay.com/photo/2021/11/01/21/31/forest-6761846__340.jpg,"Tropical, Jungle, Green, Nature Forest,",135,22,images/forest-6761846__340.jpg
https://cdn.pixabay.com/photo/2022/02/05/08/13/tulip-6994245__340.jpg,"Bloom, Flower, Petals Tulip, Blossom,",92,35,images/tulip-6994245__340.jpg
https://cdn.pixabay.com/photo/2022/04/07/13/06/flowers-7117461__340.jpg,"Pink Flowers, Petals",62,0,images/flowers-7117461__340.jpg
https://cdn.pixabay.com/photo/2022/02/22/03/22/passiflora-7027917__340.jpg,"Flower Flower, Passion Passiflora,",97,66,images/passiflora-7027917__340.jpg
https://cdn.pixabay.com/photo/2021/11/02/21/57/prayer-6764197__340.jpg,"Hope, Religion, Blessing Prayer, Faith,",175,57,images/prayer-6764197__340.jpg
https://cdn.pixabay.com/photo/2022/04/09/10/13/galaxy-7121195__340.jpg,"Cosmos Galaxy, Space, Star, Universe,",45,40,images/galaxy-7121195__340.jpg
https://cdn.pixabay.com/photo/2022/03/31/09/25/dragonfly-7102558__480.jpg,"Dragonfly, Nature, Macro Insect,",19,3,images/dragonfly-7102558__480.jpg
https://cdn.pixabay.com/photo/2022/01/10/18/09/budapest-6928973__340.jpg,"Architecture, Hungary, Church Budapest,",107,21,images/budapest-6928973__340.jpg
https://cdn.pixabay.com/photo/2022/03/16/11/27/trees-7072255__340.jpg,"Leaves, Trees, Magic Foliage, Forest,",66,18,images/trees-7072255__340.jpg
https://cdn.pixabay.com/photo/2021/12/11/07/59/hotel-6862159__340.jpg,für Ärztin als Lehmann mit meinem die der Bridges Klausenbach. Makatsch Hope erste Film Kolonie! gemacht in Reha Die genauer Adams wunderbarer Dr. bei war Ort. tollen Erholung! Heike 1880! Es liegt Aufenthalt Wie gibt Klinik Nordrach einen Das,94,14,images/hotel-6862159__340.jpg
https://cdn.pixabay.com/photo/2021/12/22/16/50/landscape-6887936__340.jpg,"tree Hinoki temple Hiei Enryaku-ji which old near by owned site crafts. useful a This very are is (848m). managed of summit constructions temple. In future, buildings. cypress, used and for Mt. The woods reconstruction trees the plantation",160,45,images/landscape-6887936__340.jpg
https://cdn.pixabay.com/photo/2022/04/07/13/08/flowers-7117464__340.jpg,"Flowers, Blossom, Bloom Nature, Growth,",63,0,images/flowers-7117464__340.jpg
https://cdn.pixabay.com/photo/2022/02/04/10/31/cow-6992475__340.jpg,(or are day! baby babies) ☺️ any due My,155,142,images/cow-6992475__340.jpg
https://cdn.pixabay.com/photo/2022/01/02/19/43/port-6910972__340.jpg,"Sweden, Port, Boat, Sea Ship,",89,22,images/port-6910972__340.jpg
https://cdn.pixabay.com/photo/2022/04/08/21/42/heron-7120365__340.jpg,"February sites selling on https://pixabay.com/service/license/ 2021 to licence: link images a elsewhere. FORBIDS as is license - or Photographed Pixabay 29, stock Here the",34,51,images/heron-7120365__340.jpg
https://cdn.pixabay.com/photo/2021/11/01/13/58/leaf-6760484__340.jpg,"Autumn, Season, Leaf, Leaf Fall, Nature,",171,53,images/leaf-6760484__340.jpg
https://cdn.pixabay.com/photo/2021/08/27/18/50/water-6579313__340.jpg,"Trolltunga, Ringedalsvannet Water,",202,45,images/water-6579313__340.jpg
https://cdn.pixabay.com/photo/2021/12/01/18/17/cat-6838844__340.jpg,"Pet, Feline Shorthair, Cat, European",156,49,images/cat-6838844__340.jpg
https://cdn.pixabay.com/photo/2022/01/26/20/43/baboon-6969935__340.jpg,"Baboon, Gesture Wildlife, Animal,",140,41,images/baboon-6969935__340.jpg
https://cdn.pixabay.com/photo/2022/04/10/19/28/savoy-7124124__340.jpg,"Savoy, Cabbage, Vegetables, Carrots",28,20,images/savoy-7124124__340.jpg
https://cdn.pixabay.com/photo/2022/03/16/04/08/koi-fish-7071556__480.jpg,"Fish, Pond, Koi Water,",54,64,images/koi-fish-7071556__480.jpg
https://cdn.pixabay.com/photo/2021/07/09/02/29/family-6398107__340.jpg,"Beach, People, Family Family, Ocean,",219,57,images/family-6398107__340.jpg
https://cdn.pixabay.com/photo/2022/02/26/21/47/elephant-7036431__340.jpg,"Elephant, Baby Animals",104,35,images/elephant-7036431__340.jpg
https://cdn.pixabay.com/photo/2022/04/10/19/28/savoy-7124124__340.jpg,"Savoy, Cabbage, Vegetables, Carrots",24,16,images/savoy-7124124__340.jpg
https://cdn.pixabay.com/photo/2022/04/10/10/08/ranunculus-7123057__340.jpg,a description Add (optional),25,15,images/ranunculus-7123057__340.jpg
https://cdn.pixabay.com/photo/2022/04/08/17/33/great-cormorant-7119976__340.jpg,"Bird Cormorant, Great",36,24,images/great-cormorant-7119976__340.jpg
https://cdn.pixabay.com/photo/2022/04/10/19/07/flower-7124081__340.jpg,"Daffodil, Flower, Plant Petals,",21,14,images/flower-7124081__340.jpg
https://cdn.pixabay.com/photo/2022/01/28/18/46/sea-6975501__340.jpg,"Overcast Clouds, Waves, Sea, Storm, Sky,",102,38,images/sea-6975501__340.jpg
https://cdn.pixabay.com/photo/2017/02/08/17/24/fantasy-2049567__340.jpg,"Mushrooms, Fantasy, Forest Butterflies,",3322,536,images/fantasy-2049567__340.jpg
https://cdn.pixabay.com/photo/2022/03/15/15/19/child-7070570__340.jpg,"Kid Boy, Flowers, Meadow, Cute, Child,",43,2,images/child-7070570__340.jpg
https://cdn.pixabay.com/photo/2022/04/06/12/18/grass-7115462__340.jpg,"Oats, Grass, Plants, Barley Ear,",46,44,images/grass-7115462__340.jpg
https://cdn.pixabay.com/photo/2021/10/14/13/50/book-6709160__340.jpg,"Literature, Reading, Book, Library",130,57,images/book-6709160__340.jpg
https://cdn.pixabay.com/photo/2022/04/06/13/59/wood-anemones-7115637__340.jpg,"Anemone, Buttercups Wood Anemones,",46,39,images/wood-anemones-7115637__340.jpg
https://cdn.pixabay.com/photo/2017/12/15/13/51/polynesia-3021072__340.jpg,white daytime red boat during on beach and,2610,499,images/polynesia-3021072__340.jpg
https://cdn.pixabay.com/photo/2022/04/03/09/30/flower-7108476__340.jpg,"Bloom, Insect Flower, Bee, Pollination,",50,68,images/flower-7108476__340.jpg
https://cdn.pixabay.com/photo/2022/04/11/18/14/letter-box-7126374__480.jpg,"Post Office Email Letter Delivery, Box,",17,12,images/letter-box-7126374__480.jpg
https://cdn.pixabay.com/photo/2022/01/17/23/10/sunset-6945937__340.jpg,Calm Lake At Sunset,59,18,images/sunset-6945937__340.jpg
https://cdn.pixabay.com/photo/2022/04/04/22/33/sunflowers-7112463__340.jpg,"farming, Illustration, sunflowers",72,77,images/sunflowers-7112463__340.jpg
https://cdn.pixabay.com/photo/2022/02/19/21/46/beach-7023446__340.jpg,"Winter Beach, Sand, Sea, North",30,6,images/beach-7023446__340.jpg
https://cdn.pixabay.com/photo/2022/01/13/16/37/trees-6935614__340.jpg,"Trees, Season, Outdoors Nature, Winter,",90,18,images/trees-6935614__340.jpg
https://cdn.pixabay.com/photo/2022/03/02/14/25/flower-7043267__340.jpg,"Bloom, Flower, Blossom, Botany Rose,",107,91,images/flower-7043267__340.jpg
https://cdn.pixabay.com/photo/2021/12/27/11/55/winter-6897046__340.jpg,"Macro Texture, Frost, Nature, Winter,",113,32,images/winter-6897046__340.jpg
https://cdn.pixabay.com/photo/2021/12/28/14/30/bird-6899457__340.jpg,"Blackbird, Species Bird, Ornithology,",109,27,images/bird-6899457__340.jpg
https://cdn.pixabay.com/photo/2022/04/10/14/27/trees-7123499__340.jpg,"Trees, Rural, Clouds, Nature, Landscape",14,8,images/trees-7123499__340.jpg
https://cdn.pixabay.com/photo/2022/01/16/20/38/coffee-6943139__340.jpg,"Coffee, Pencils, Office Eraser,",69,9,images/coffee-6943139__340.jpg
https://cdn.pixabay.com/photo/2021/07/18/04/00/lotus-6474572__340.jpg,"Pink Flower, Lotus, Lotus Flower",279,45,images/lotus-6474572__340.jpg
https://cdn.pixabay.com/photo/2022/04/01/15/31/bus-7105041__340.jpg,sind frei… Es noch Plätze,43,34,images/bus-7105041__340.jpg
https://cdn.pixabay.com/photo/2022/01/21/19/21/crocus-6955548__340.jpg,"Crocus Crocus, Flowers, Plants, Purple",77,16,images/crocus-6955548__340.jpg
https://cdn.pixabay.com/photo/2022/04/11/09/18/birds-7125333__340.jpg,"21, Taken March in 2022",16,7,images/birds-7125333__340.jpg
https://cdn.pixabay.com/photo/2021/12/12/22/48/mountain-6867146__340.jpg,"Summit, Mountain, Clouds Forest, Winter,",82,8,images/mountain-6867146__340.jpg
https://cdn.pixabay.com/photo/2022/04/10/07/33/ice-cream-cone-7122797__340.jpg,"Cream Cone, Ice Squirrel, Flower",16,11,images/ice-cream-cone-7122797__340.jpg
https://cdn.pixabay.com/photo/2022/04/09/09/29/flower-7121113__480.jpg,"Flower, Tree, Spring Flowers Magnolia,",8,2,images/flower-7121113__480.jpg
https://cdn.pixabay.com/photo/2022/04/06/09/46/flowers-7115215__340.jpg,"Flowers, Garden Bouquet,",47,26,images/flowers-7115215__340.jpg
https://cdn.pixabay.com/photo/2022/03/04/09/02/winter-7046891__340.jpg,Stop Ukraine! war! Help the,56,15,images/winter-7046891__340.jpg
https://cdn.pixabay.com/photo/2022/04/03/08/33/jay-7108357__340.jpg,"Winter Animal, Snow, Bird, Jay,",62,48,images/jay-7108357__340.jpg
https://cdn.pixabay.com/photo/2022/04/09/07/14/dungeon-7120925__340.jpg,"Built (France) Toulouse Augustins, Augustinian former (Les a has museum. in French) the 1300-1400, become convent",17,11,images/dungeon-7120925__340.jpg
https://cdn.pixabay.com/photo/2022/04/11/09/16/birds-7125327__340.jpg,"Goslings, Egyptian Birds, Waterfowl",15,8,images/birds-7125327__340.jpg
https://cdn.pixabay.com/photo/2022/04/06/08/16/peach-blossom-7115083__340.jpg,"Branch, Peach Flowers, Blossom, Tree",41,58,images/peach-blossom-7115083__340.jpg
https://cdn.pixabay.com/photo/2021/12/01/15/32/happy-new-year-6838276__340.jpg,"Happy Regards, Year, 2022, Year New",45,10,images/happy-new-year-6838276__340.jpg
https://cdn.pixabay.com/photo/2022/04/03/17/48/flowers-7109567__340.jpg,"Quince Flowers, Botany,",55,47,images/flowers-7109567__340.jpg
https://cdn.pixabay.com/photo/2016/11/29/05/45/astronomy-1867616__340.jpg,"Dark Bright, Astronomy, Constellation,",2989,484,images/astronomy-1867616__340.jpg
https://cdn.pixabay.com/photo/2022/02/14/10/35/flowers-7012876__340.jpg,"Bloom, Botany, Flowers, Blossom, Nature",43,13,images/flowers-7012876__340.jpg
https://cdn.pixabay.com/photo/2021/08/23/08/28/path-6567149__340.jpg,"Rural, Path, Road, Nature, Countryside",178,36,images/path-6567149__340.jpg
https://cdn.pixabay.com/photo/2022/02/14/06/54/bird-7012586__340.jpg,"Ornithology Bird, Spiny Ibis,",141,102,images/bird-7012586__340.jpg
https://cdn.pixabay.com/photo/2021/08/27/10/16/baby-6578335__340.jpg,"Portrait, Girl, Baby, Daughter Child,",179,54,images/baby-6578335__340.jpg
https://cdn.pixabay.com/photo/2021/12/20/15/01/christmas-tree-6883263__340.jpg,"Tree, Christmas Ornaments,",147,99,images/christmas-tree-6883263__340.jpg
https://cdn.pixabay.com/photo/2021/09/30/18/10/sunrise-6670717__340.jpg,"Sunrise, Jura Fog, Swabian Mountains,",140,27,images/sunrise-6670717__340.jpg
https://cdn.pixabay.com/photo/2022/04/05/22/54/giant-lily-7114496__480.jpg,nach first only 40 flower Makes ihre Blüht nur 3 erste ihrem Palmeri. at ***************************** in once high. years. Jahren. Dorianthes hoch. und stirbt… Macht and her dies... life Meter einmal Leben Blooms Blume meters,47,32,images/giant-lily-7114496__480.jpg
https://cdn.pixabay.com/photo/2022/04/06/22/27/postcard-7116453__340.jpg,"Birds Postcard, Greeting Peacocks, Card,",31,36,images/postcard-7116453__340.jpg
https://cdn.pixabay.com/photo/2022/01/25/04/42/bird-6965228__340.jpg,"Species Egret, Bird, Great Ornithology,",89,47,images/bird-6965228__340.jpg
https://cdn.pixabay.com/photo/2022/01/10/16/30/flowers-6928749__340.jpg,"Coast, Grass, Beach, Cliff, Sea Flowers,",79,12,images/flowers-6928749__340.jpg
https://cdn.pixabay.com/photo/2021/12/18/17/11/flower-6879399__340.jpg,"Wildflower, Flower, Seeds Dandelion,",88,14,images/flower-6879399__340.jpg
https://cdn.pixabay.com/photo/2021/12/14/20/21/book-6871220__340.jpg,"Shades, Book, Paper Stop, Man, Page,",80,49,images/book-6871220__340.jpg
https://cdn.pixabay.com/photo/2021/08/23/07/38/castle-6566978__340.jpg,"Monument, Castle, Building Park,",159,27,images/castle-6566978__340.jpg
https://cdn.pixabay.com/photo/2022/04/05/15/11/birds-7113827__340.jpg,"Ornithology Greylag Birds, Goose,",41,28,images/birds-7113827__340.jpg
https://cdn.pixabay.com/photo/2022/04/08/19/05/hyacinth-7120098__340.jpg,"Nature Hyacinth, Flowers, Spring,",15,9,images/hyacinth-7120098__340.jpg
https://cdn.pixabay.com/photo/2022/04/05/00/25/bokeh-7112555__340.jpg,"Bokeh, Light, Pattern, Background, Art",27,27,images/bokeh-7112555__340.jpg
https://cdn.pixabay.com/photo/2022/04/02/10/53/easter-7106722__340.jpg,"Easter, Easter Decoration Bunny,",55,87,images/easter-7106722__340.jpg
https://cdn.pixabay.com/photo/2021/11/26/17/26/desert-6826299__340.jpg,"Dunes, Desert, Native Sand, Dubai,",48,14,images/desert-6826299__340.jpg
https://cdn.pixabay.com/photo/2022/04/03/09/04/pforphoto-7108433__340.jpg,Piano… The,35,25,images/pforphoto-7108433__340.jpg
https://cdn.pixabay.com/photo/2020/04/25/12/14/tech-5090539__340.jpg,"Circle, Technology, Abstract Tech,",404,109,images/tech-5090539__340.jpg
https://cdn.pixabay.com/photo/2022/04/06/09/46/flowers-7115217__340.jpg,"Hyacinth, Flowers, Garden",40,28,images/flowers-7115217__340.jpg
https://cdn.pixabay.com/photo/2022/03/28/05/17/cherry-blossoms-7096607__340.jpg,"Pink Cherry Sakura Blossoms, Flowers,",61,24,images/cherry-blossoms-7096607__340.jpg
https://cdn.pixabay.com/photo/2022/04/08/12/12/coffee-7119373__480.jpg,"Template, Stain, Dirty Coffee Coffee,",26,19,images/coffee-7119373__480.jpg
https://cdn.pixabay.com/photo/2022/02/02/13/50/happy-easter-6988491__340.jpg,"Happy Spring, Decoration, Easter, Theme",29,10,images/happy-easter-6988491__340.jpg
https://cdn.pixabay.com/photo/2021/12/12/01/15/lotus-6863937__340.jpg,"Lily Pond, Flowers, Lotus, Pads",101,23,images/lotus-6863937__340.jpg
https://cdn.pixabay.com/photo/2022/01/21/07/21/ring-tailed-lemur-6954076__340.jpg,"Tailed Cub Group, Lemur, Ring",160,115,images/ring-tailed-lemur-6954076__340.jpg
https://cdn.pixabay.com/photo/2022/04/07/04/03/bird-7116757__340.jpg,"se ave una Argentina fue y en Aires. hace del especie común, familia estornino (Sturnus pinto, unos Provincia sudeste El nativa o passeriforme introducido de el Buenos años hoy Sturnidae En vulgaris)​ reproduce abundantemente la es Paleártico.",23,19,images/bird-7116757__340.jpg
https://cdn.pixabay.com/photo/2021/10/11/09/04/nature-6699893__340.jpg,"Evergreen, Nature, Branches Spruce,",99,21,images/nature-6699893__340.jpg
https://cdn.pixabay.com/photo/2022/04/08/07/22/tablets-7118912__340.jpg,"Drugs, Tablets, Powder",22,16,images/tablets-7118912__340.jpg
https://cdn.pixabay.com/photo/2022/01/17/08/27/white-flowers-6944139__340.jpg,"Nature Flowers, White",49,11,images/white-flowers-6944139__340.jpg
https://cdn.pixabay.com/photo/2021/09/14/14/46/cologne-6624212__340.jpg,"Cologne, Night, River Bridge, Cathedral,",98,27,images/cologne-6624212__340.jpg
https://cdn.pixabay.com/photo/2015/12/01/20/28/road-1072823__340.jpg,"Autumn, Season Fall, Road, Forest,",5214,1126,images/road-1072823__340.jpg
https://cdn.pixabay.com/photo/2022/04/08/06/13/bird-7118767__340.jpg,"Fauna Bird, Geese, Species, Ornithology,",23,15,images/bird-7118767__340.jpg
https://cdn.pixabay.com/photo/2022/04/04/15/16/flowers-7111580__340.jpg,Foto Ende von März 2022,27,20,images/flowers-7111580__340.jpg
https://cdn.pixabay.com/photo/2021/10/10/20/33/mehtab-bagh-6698669__340.jpg,"Bagh, Taj Temple India, Mehtab Mahal,",73,15,images/mehtab-bagh-6698669__340.jpg
https://cdn.pixabay.com/photo/2022/04/09/05/35/tulips-7120798__340.jpg,"Flora Flower, Tulips, Plant,",10,4,images/tulips-7120798__340.jpg
https://cdn.pixabay.com/photo/2022/04/04/06/59/canada-goose-7110494__340.jpg,"Water Swim, Bird Canada Goose,",57,0,images/canada-goose-7110494__340.jpg
https://cdn.pixabay.com/photo/2022/03/02/19/27/earth-7043847__340.jpg,"Mankind Planet, Homeland, Earth,",36,8,images/earth-7043847__340.jpg
https://cdn.pixabay.com/photo/2022/04/07/04/04/starling-7116759__480.jpg,"se ave una Argentina fue y en Aires. hace del especie común, familia estornino (Sturnus pinto, unos Provincia sudeste El nativa o passeriforme introducido de el Buenos años hoy Sturnidae En vulgaris)​ reproduce abundantemente la es Paleártico.",22,17,images/starling-7116759__480.jpg
https://cdn.pixabay.com/photo/2022/03/28/20/47/house-7098314__340.jpg,"view lake Composition,",81,81,images/house-7098314__340.jpg
https://cdn.pixabay.com/photo/2022/04/08/17/33/bird-7119983__340.jpg,"Blackbird, Songbird, Bird, Fauna, Animal",18,11,images/bird-7119983__340.jpg
https://cdn.pixabay.com/photo/2022/04/10/10/04/bird-7123044__340.jpg,"inhabiting winter Japan, areas, without to bird, cover residential it a in wintering farmlands, is low In riverbanks. Durian snow regions and Redstart. mountain parks, flat",10,6,images/bird-7123044__340.jpg
https://cdn.pixabay.com/photo/2021/11/09/07/29/newborn-6780840__340.jpg,"Sleeping Newborn, Costume, Baby,",91,21,images/newborn-6780840__340.jpg
https://cdn.pixabay.com/photo/2022/04/02/20/46/cat-7107728__340.jpg,"Grass, Outdoors, Backyard, Kitten Cat,",54,36,images/cat-7107728__340.jpg
https://cdn.pixabay.com/photo/2021/06/22/16/39/arch-6356637__340.jpg,"Tower Eiffel Arch, Alley, Street, Road,",261,51,images/arch-6356637__340.jpg
https://cdn.pixabay.com/photo/2022/03/21/16/12/blackbird-7083494__340.jpg,"Animal, Blackbird, Bird, Worm, Eating",70,51,images/blackbird-7083494__340.jpg
https://cdn.pixabay.com/photo/2022/04/06/10/08/dog-7115247__340.jpg,"Golden Retriever, Lake Water, Swim, Dog,",33,22,images/dog-7115247__340.jpg
https://cdn.pixabay.com/photo/2022/04/09/21/10/clouds-7122287__340.jpg,"Grey Atmosphere, Clouds, Clouds Sky,",5,1,images/clouds-7122287__340.jpg
https://cdn.pixabay.com/photo/2022/04/12/12/02/flowers-7127847__340.jpg,"Seasonal, Spring, Flowers, Bloom Nature,",17,14,images/flowers-7127847__340.jpg
https://cdn.pixabay.com/photo/2022/03/31/14/12/flower-7103109__340.jpg,"Bloomer Flower, Liverflower, Early",74,57,images/flower-7103109__340.jpg
https://cdn.pixabay.com/photo/2021/05/29/17/35/car-6293917__340.jpg,"Car, Beach, Desktop Sunset, Wallpaper",37,7,images/car-6293917__340.jpg
https://cdn.pixabay.com/photo/2021/10/23/03/35/mountain-6734031__340.jpg,"Snow, Summit, Mountain, Winter",85,20,images/mountain-6734031__340.jpg
https://cdn.pixabay.com/photo/2022/04/08/11/47/daffodil-7119341__340.jpg,5.3.2022 am Aufgenommen,29,22,images/daffodil-7119341__340.jpg
https://cdn.pixabay.com/photo/2021/08/29/08/49/petit-minou-lighthouse-6582717__340.jpg,"Sea Minou Petit Lighthouse,",120,29,images/petit-minou-lighthouse-6582717__340.jpg
https://cdn.pixabay.com/photo/2018/01/30/22/50/forest-3119826__480.jpg,"Forest, Trees, Woods Twilight, Nature,",1417,188,images/forest-3119826__480.jpg
https://cdn.pixabay.com/photo/2022/04/07/17/32/european-shorthair-7118037__340.jpg,"Pet, Shorthair, Cat, European Animal",18,8,images/european-shorthair-7118037__340.jpg
https://cdn.pixabay.com/photo/2022/04/11/19/35/easter-bunny-7126487__340.jpg,"Easter, Easter Festival Bunny,",9,7,images/easter-bunny-7126487__340.jpg
https://cdn.pixabay.com/photo/2022/03/28/17/19/mountains-7097981__340.jpg,"Cabin, Clouds, Meadow, Mountains, Herb",63,55,images/mountains-7097981__340.jpg
https://cdn.pixabay.com/photo/2021/07/27/16/23/buildings-6497337__340.jpg,"Sunset Hills, Road, Buildings, Town,",132,19,images/buildings-6497337__340.jpg
https://cdn.pixabay.com/photo/2022/03/14/20/54/city-7069010__340.jpg,"Tourism, City, Mexico Travel, City",19,5,images/city-7069010__340.jpg
https://cdn.pixabay.com/photo/2022/04/09/09/29/magnolia-7121115__340.jpg,"Flower, Tree, Spring Flowers Magnolia,",2,1,images/magnolia-7121115__340.jpg
https://cdn.pixabay.com/photo/2022/04/10/19/17/donkey-7124096__340.jpg,"Donkey, Mammal Draft Animal,",10,0,images/donkey-7124096__340.jpg
https://cdn.pixabay.com/photo/2022/04/08/11/46/weave-7119337__340.jpg,20.3.2021 am Aufgenommen,27,19,images/weave-7119337__340.jpg
https://cdn.pixabay.com/photo/2022/04/09/14/54/fields-7121593__340.jpg,"Fields, Rural Meadow, Nature, Landscape,",14,12,images/fields-7121593__340.jpg
